Speaker,Content,威圧度,逸脱度,発言無効度,偏り度
進行役,本日はお集まりいただきありがとうございます。自動会議設定機能のトライアルに伴うアンケート評価結果を報告し、その改善案について議論していきたいと思います。,,,,
本部長,それでは、さっそくアンケート結果についてお願いできますか。私もこの機能にとても期待しています。,,,,
課長,はい、主なポイントがいくつかあります。まず、ユーザーからのフィードバックは…,,,,
リーダー,正直、私もこの機能を試してみたのですが、使い勝手は良いと思いました。特に会議の設定が楽になったのが嬉しいですね。,,,,
本部長,そうそう、導入時は一部のメンバーが混乱していましたが、その後のサポートが良かったですね。,,,,
進行役,では、各フィードバックの詳細について…,,,,
課長,そのサポートが大切ですね。私も先日、設定を手伝うことがありましたが、最初は戸惑いました。,,,,
リーダー,私も似たような経験があります。最初は手間取ってしまいましたが、慣れれば楽ですよね。,,,,
本部長,そういえば、あの担当者が頑張ってくれたおかげで、今ではすぐに設定できますね。彼は登山が趣味で、実は私も先週山に行ったんですよ。,,,,
進行役,すみません、少し本題に戻りまして…,,,,
課長,ああ、でも山の話も面白いですね。私たちもチームでハイキングに行けたらいいなと思います！,,,,
リーダー,ハイキングは良いアイデアですね！私も最近、アウトドアを楽しむようになったんです。,,,,
本部長,それで思い出したんですが、最近の休暇に行ったキャンプが素晴らしかったんですよ。台風がいなければもっと楽しめたのに…,,,,
進行役,あの、そろそろ結果を確認しましょうか。,,,,
課長,結果をもとに、今後の改善案を話し合うべきですね。私は、特にデザインの見直しが必要だと思います。,,,,
リーダー,同意です。ユーザーにとってわかりやすいインターフェースが求められます。,,,,
本部長,デザインといえば、最近のスマートフォンのデザインが気になりますね。特にカメラはすごい。,,,,
進行役,はい、あの、機能改善の話に戻りますが…,,,,
課長,まあまあ、コミュニケーションも大事ですから、こういう話も悪くないですね。,,,,
リーダー,でも、効率性も必要ですよね。この機能の改良点の1つは…,,,,
本部長,私も、効率性に加えて使いやすさが重要だと思います。そういえば、先日、孫がなんか新しいゲームを始めたって言ってました。,,,,
進行役,それでは、次の項目に移る前に…,,,,
課長,ゲームといえば、最近はAR技術を使ったものが多いですね。昔のゲームが懐かしいです。,,,,
リーダー,懐かしいですね！私も小さい頃に遊んだゲームを友人と話すと楽しくなります。,,,,
本部長,昔のゲームの話、特にファミコンとか盛り上がりますよね。私も友達とよくやってました。,,,,
進行役,あの、すみません、本題に戻りますが…,,,,
課長,コミュニケーションが大事ですから、こういう脱線も必要ですよね！,,,,
リーダー,その通り！会議中にリラックスすることも大事です。,,,,
本部長,最後に、みんなで旅行するのも良いと思います。特に温泉地とか、リフレッシュになりますよね。,,,,
進行役,すみません、今後の会議の進め方について再度…,,,,
課長,旅行といえば、昨年行った海の話を思い出します。,,,,
リーダー,海も良いですね！私もあの時の旅行が楽しかったです。,,,,
本部長,さて、そろそろまとめに入りたいと思います。,,,,
進行役,それでは、本日の内容を整理しましょう。,,,,
課長,最終的に、皆さんが提案した改善点をまとめて、次に進めるようにしましょう。,,,,
リーダー,皆さん、今日は楽しい時間をありがとうございました。次回も楽しみにしています。,,,,
本部長,お疲れ様でした。次回はまた新しい話題を持ってきますね。ありがとうございました。,,,,
進行役,ありがとうございました。それでは、解散いたします。,,,,
